{
  "$schema": "https://json-schema.org/draft/2020-12/schema",
  "type": "object",
  "required": [
    "asset_integrity",
    "trust_outcome",
    "process_integrity",
    "policy_evidence",
    "gateway_mediation"
  ],
  "properties": {
    "asset_integrity": {
      "type": "string"
    },
    "assertion_binding": {
      "type": "string"
    },
    "issuer_recognition": {
      "type": "string"
    },
    "actor_authorization": {
      "type": "string"
    },
    "process_integrity": {
      "type": "string"
    },
    "policy_freshness": {
      "type": "string"
    },
    "verification_mode": {
      "type": "string"
    },
    "trust_outcome": {
      "type": "string"
    },
    "process_appraisal": {
      "type": "object"
    },
    "policy_evidence": {
      "type": "object"
    },
    "gateway_mediation": {
      "type": "object"
    },
    "explanations": {
      "type": "array",
      "items": {
        "type": "string"
      }
    },
    "assertion_evaluation": {
      "type": "object"
    },
    "conflict_evaluation": {
      "type": "object"
    },
    "propositions": {
      "type": "object",
      "additionalProperties": {
        "type": "object"
      }
    }
  },
  "additionalProperties": true
}
