{
  "asset_integrity": "verified",
  "assertion_binding": "verified",
  "issuer_recognition": "recognized",
  "actor_authorization": "authorized",
  "process_integrity": "verified_high",
  "policy_freshness": "fresh",
  "verification_mode": "gateway_mediated",
  "trust_outcome": "trusted",
  "process_appraisal": {
    "status": "verified",
    "process_type": "human_assisted",
    "confidence": 0.88,
    "minimum_confidence": 0.75,
    "evidence_ref": "urn:example:pop:asset-interp-001",
    "evidence_format": "application/cpop+cbor",
    "appraisal": "gateway_vector_report",
    "reference": null
  },
  "policy_evidence": {
    "authorization_evidence": [
      "registry-entry:publisher-123",
      "policy:media-publish-v2"
    ],
    "recognition_evidence": [
      "trust-list:issuer-77"
    ],
    "policy_epoch": "2026-Q1",
    "policy_requirements": {
      "requires_process_proof": true,
      "min_process_integrity": 0.75,
      "allowed_process_types": [
        "human_assisted",
        "verified_editorial_pipeline"
      ]
    },
    "verification_profile": {
      "id": "standard",
      "base_profile": "standard",
      "controls": {
        "authority": {
          "trust_anchors_required": false,
          "allow_untrusted": true
        },
        "freshness": {
          "max_age_seconds": 3600,
          "require_live": false
        },
        "revocation": {
          "mode": "delta",
          "hard_fail": false,
          "max_age_seconds": 3600,
          "enforcement": "warn",
          "delta_channel_required": false
        },
        "failure": {
          "network_failure": "fail_open",
          "policy_unavailable": "fail_open"
        },
        "evidence": {
          "emit_audit_bundle": true,
          "require_attestation": false,
          "require_feed_descriptors": false
        },
        "descriptor_policy": {
          "policy": "observe",
          "revocation": "observe",
          "snapshot": "observe",
          "gateway_route": "observe"
        },
        "transport": {
          "mode": "http",
          "integrity": "tls",
          "availability_requirement": "best_effort"
        },
        "determinism": {
          "replayable": true,
          "require_pinned_feeds": false
        }
      },
      "overlays": [],
      "source": "profiles/standard.json"
    },
    "transport": {
      "required": {
        "mode": "http",
        "integrity": "tls",
        "availability_requirement": "best_effort"
      },
      "actual": {
        "mode": "gateway",
        "integrity": "signed",
        "available": true,
        "channel": "mediated"
      },
      "violations": [],
      "satisfied": true
    },
    "revocation_status": {
      "source": "service",
      "issued_at": "2026-12-31T00:00:00Z",
      "policy_epoch": "2026-Q1",
      "channel": "delta",
      "age_seconds": 0,
      "feed_descriptor": {
        "descriptor_id": null,
        "feed_type": null,
        "authority_id": null,
        "route_attested": false,
        "integrity_ok": false,
        "authority_ok": false,
        "signature_ok": false,
        "freshness_ok": false,
        "reason_code": "missing_feed_descriptor",
        "violations": [
          "feed descriptor is missing"
        ],
        "digest_sha256": null,
        "declared_digest_sha256": null,
        "issued_at": null,
        "valid_until": null,
        "max_age_seconds": null
      },
      "freshness_ok": true,
      "max_age_seconds": 3600,
      "enforcement": "warn",
      "violations": []
    },
    "feed_descriptors": {
      "policy": {
        "descriptor_id": null,
        "feed_type": null,
        "authority_id": null,
        "route_attested": false,
        "integrity_ok": false,
        "authority_ok": false,
        "signature_ok": false,
        "freshness_ok": false,
        "reason_code": "missing_feed_descriptor",
        "violations": [
          "feed descriptor is missing"
        ],
        "digest_sha256": null,
        "declared_digest_sha256": null,
        "issued_at": null,
        "valid_until": null,
        "max_age_seconds": null
      },
      "revocation": {
        "descriptor_id": null,
        "feed_type": null,
        "authority_id": null,
        "route_attested": false,
        "integrity_ok": false,
        "authority_ok": false,
        "signature_ok": false,
        "freshness_ok": false,
        "reason_code": "missing_feed_descriptor",
        "violations": [
          "feed descriptor is missing"
        ],
        "digest_sha256": null,
        "declared_digest_sha256": null,
        "issued_at": null,
        "valid_until": null,
        "max_age_seconds": null
      }
    }
  },
  "gateway_mediation": {
    "gateway_id": "gateway:interop",
    "route_label": "route:gateway-standard",
    "mode": "remote_policy_mediation",
    "target_authority_id": "did:web:media-registry.example",
    "decision_type": "authorization",
    "route_attested": false,
    "feed_descriptor": {
      "descriptor_id": null,
      "feed_type": null,
      "authority_id": null,
      "route_attested": false,
      "integrity_ok": false,
      "authority_ok": false,
      "signature_ok": false,
      "freshness_ok": false,
      "reason_code": "missing_feed_descriptor",
      "violations": [
        "feed descriptor is missing"
      ],
      "digest_sha256": null,
      "declared_digest_sha256": null,
      "issued_at": null,
      "valid_until": null,
      "max_age_seconds": null
    },
    "recognition": {
      "gateway_id": "gateway:interop",
      "route_label": "route:gateway-standard",
      "mode": "remote_policy_mediation",
      "target_authority_id": "did:web:media-registry.example",
      "decision_type": "recognition",
      "route_attested": false,
      "feed_descriptor": {
        "descriptor_id": null,
        "feed_type": null,
        "authority_id": null,
        "route_attested": false,
        "integrity_ok": false,
        "authority_ok": false,
        "signature_ok": false,
        "freshness_ok": false,
        "reason_code": "missing_feed_descriptor",
        "violations": [
          "feed descriptor is missing"
        ],
        "digest_sha256": null,
        "declared_digest_sha256": null,
        "issued_at": null,
        "valid_until": null,
        "max_age_seconds": null
      }
    }
  },
  "explanations": [
    "Verification profile: standard",
    "Trust gateway mediated authorization lookup",
    "Trust gateway mediated recognition lookup"
  ]
}
