{
  "asset_integrity": "verified",
  "assertion_binding": "verified",
  "issuer_recognition": "recognized",
  "actor_authorization": "authorized",
  "process_integrity": "verified_high",
  "policy_freshness": "fresh",
  "verification_mode": "gateway_mediated",
  "trust_outcome": "trusted",
  "process_appraisal": {
    "status": "verified",
    "process_type": "human_reviewed",
    "confidence": 0.95,
    "minimum_confidence": 0.9,
    "evidence_ref": "urn:example:pop:asset-interp-002",
    "evidence_format": "application/cpop+cbor",
    "appraisal": null,
    "reference": null
  },
  "policy_evidence": {
    "authorization_evidence": [
      "policy:coalition-registry:studio:publish"
    ],
    "recognition_evidence": [
      "recognition:coalition-registry:issuer-eu"
    ],
    "policy_epoch": "2026-03-15T00:00:00Z",
    "policy_requirements": {
      "requires_process_proof": true,
      "min_process_integrity": 0.9,
      "allowed_process_types": [
        "human_reviewed"
      ]
    },
    "verification_profile": {
      "id": "standard",
      "base_profile": "standard",
      "controls": {
        "authority": {
          "trust_anchors_required": false,
          "allow_untrusted": true
        },
        "freshness": {
          "max_age_seconds": 3600,
          "require_live": false
        },
        "revocation": {
          "mode": "delta",
          "hard_fail": false,
          "max_age_seconds": 3600,
          "enforcement": "warn",
          "delta_channel_required": false
        },
        "failure": {
          "network_failure": "fail_open",
          "policy_unavailable": "fail_open"
        },
        "evidence": {
          "emit_audit_bundle": true,
          "require_attestation": false,
          "require_feed_descriptors": false
        },
        "descriptor_policy": {
          "policy": "observe",
          "revocation": "observe",
          "snapshot": "observe",
          "gateway_route": "observe"
        },
        "transport": {
          "mode": "http",
          "integrity": "tls",
          "availability_requirement": "best_effort"
        },
        "determinism": {
          "replayable": true,
          "require_pinned_feeds": false
        }
      },
      "overlays": [],
      "source": "profiles/standard.json"
    },
    "transport": {
      "required": {
        "mode": "http",
        "integrity": "tls",
        "availability_requirement": "best_effort"
      },
      "actual": {
        "mode": "gateway",
        "integrity": "signed",
        "available": true,
        "channel": "mediated"
      },
      "violations": [],
      "satisfied": true
    },
    "revocation_status": {
      "source": "none",
      "channel": "none",
      "age_seconds": null,
      "freshness_ok": true,
      "max_age_seconds": 3600,
      "enforcement": "warn",
      "violations": []
    },
    "feed_descriptors": {}
  },
  "gateway_mediation": {
    "gateway_id": "gateway:mesh",
    "route_label": "route:coalition-eu",
    "mode": "remote_policy_mediation",
    "target_authority_id": "did:web:coalition-registry.example",
    "decision_type": "authorization",
    "route_attested": false,
    "feed_descriptor": {
      "descriptor_id": null,
      "feed_type": null,
      "authority_id": null,
      "route_attested": false,
      "integrity_ok": false,
      "authority_ok": false,
      "signature_ok": false,
      "freshness_ok": false,
      "reason_code": "missing_feed_descriptor",
      "violations": [
        "feed descriptor is missing"
      ],
      "digest_sha256": null,
      "declared_digest_sha256": null,
      "issued_at": null,
      "valid_until": null,
      "max_age_seconds": null
    },
    "recognition": {
      "gateway_id": "gateway:mesh",
      "route_label": "route:coalition-eu",
      "mode": "remote_policy_mediation",
      "target_authority_id": "did:web:coalition-registry.example",
      "decision_type": "recognition",
      "route_attested": false,
      "feed_descriptor": {
        "descriptor_id": null,
        "feed_type": null,
        "authority_id": null,
        "route_attested": false,
        "integrity_ok": false,
        "authority_ok": false,
        "signature_ok": false,
        "freshness_ok": false,
        "reason_code": "missing_feed_descriptor",
        "violations": [
          "feed descriptor is missing"
        ],
        "digest_sha256": null,
        "declared_digest_sha256": null,
        "issued_at": null,
        "valid_until": null,
        "max_age_seconds": null
      }
    }
  },
  "explanations": [
    "Verification profile: standard",
    "Trust gateway mediated authorization lookup",
    "Trust gateway mediated recognition lookup"
  ]
}
